{
  "$schema": "./pre75-canonical-response-schema-transmission-payload.schema.v0.1.json",
  "document_id": "TITMAS-CS-D02-PRE75-CANONICAL-RESPONSE-SCHEMA-TRANSMISSION-PAYLOAD-0.1",
  "version": "0.1.0",
  "status": "DETERMINISTIC_DERIVATION_CONTRACT_NOT_ADOPTED",
  "source_schema_reference": "../commercialization-standards-p0-exact-agent-security-review/pre73-agent-review-response.schema.v0.2.json",
  "source_schema_file_sha256": "567434aacc1c6747771e96d5238568fa6906d8a24db51cf74afab838847684c8",
  "canonicalization": "UTF8_JSON_SORT_KEYS_TRUE_SEPARATORS_COMMA_COLON_ENSURE_ASCII_FALSE",
  "canonical_payload_bytes": 5271,
  "canonical_payload_sha256": "fa515e139eb5915f48b2ed6fda9f4b85275f9f6ac4c5b49e69cecf4b8afdc2af",
  "transmission_policy": {
    "embedded_in_each_future_user_message": true,
    "occurrences_per_message": 1,
    "begin_marker": "RESPONSE_SCHEMA_CANONICAL_JSON_BEGIN",
    "end_marker": "RESPONSE_SCHEMA_CANONICAL_JSON_END",
    "source_file_hash_transmitted": true,
    "canonical_payload_hash_transmitted": true
  },
  "persistence_policy": {
    "canonical_payload_duplicated_in_this_artifact": false,
    "future_raw_request_persisted": false,
    "future_source_package_persisted": false
  },
  "effects": {
    "response_schema_changed": false,
    "request_contract_adopted": false,
    "live_rerun_authorized": false
  }
}
